{
  "rolle": "bauen",
  "issue": "SIN-832",
  "zeitpunkt": "2026-10-19T17:26:34Z",
  "status": "blockiert",
  "zusammenfassung": "Fallback-Policy und atomarer Speichervertrag vorbereitet, zehn Simulationstests grün. Kein Produktionsadapter oder automatischer Providerwechsel belegt. Prüfer scheitert vor Modellaufruf an fehlenden Modell-/Preisvariablen, Ledger zusätzlich HTTP 400.",
  "naechster_schritt": "Unabhängigen Review und CI prüfen. Codex-Kommentar-Zuordnung und dauerhaften issueweiten Speicher-/Startadapter nachweisen, Prüferkonfiguration und Ledger klären, danach Sicherheitsfreigabe und Live-Abnahme. SIN-832 bleibt offen.",
  "kosten_eur": 0,
  "quellen": [
    "https://linear.app/sinan-kahraman/issue/SIN-832",
    "https://github.com/siinanXD/Leitstand/pull/294#issuecomment-6272812637",
    "https://github.com/siinanXD/Leitstand/actions/runs/39252951628/job/118061027159",
    "docs/decisions/SIN-832-fallback.md"
  ],
  "art": "code",
  "pr": "https://github.com/siinanXD/Leitstand/pull/294",
  "geaendert": ["src/lib/loop/fallback.ts", "src/lib/loop/fallback.test.ts", "README.md", "docs/CODEX-WORKER.md", "docs/abnahme.yml", "docs/autonomy/rollen.json", "docs/decisions/SIN-832-fallback.md", "docs/autonomy/laeufe/SIN-832.json"]
}
